timestamp,model,idea
2025-03-13 11:49:54,ollama-gemma:2b,Identify and trade high-probability breakout opportunities within bearish engulfing patterns.
2025-03-13 11:50:08,ollama-gemma:2b,Identify and trade liquidations within support and resistance zones.
2025-03-13 11:50:23,ollama-gemma:2b,Combine Bollinger Bands with Stochastic Oscillator to identify potential reversals:
2025-03-13 11:51:02,ollama-DeepSeek-R1:latest,"Enter a long position when MACD divergence occurs from price action and volume spikes, holding until Bollinger Bands widen by 20%, and exit using a take-profit level based on ATR volatility."
2025-03-13 11:51:22,ollama-llama3.2:latest,A momentum-based strategy that captures overbought conditions by buying when implied volatility (VIX) falls below 20% below its historical average while the VIX-based Gamma Skew index is in a bullish crossover phase with its previous three months.
2025-03-13 11:51:41,ollama-llama3.2:latest,"A momentum-based strategy that buys underperforming stocks with high sell-side ratings above their 50-day moving average, selling winners that have breached their all-time highs since the start of the year."
2025-03-13 11:51:58,ollama-gemma:2b,"A novel volatility-based trading strategy that utilizes moving averages and RSI divergence to identify potential breakout opportunities within consolidation phases, exiting when both the average and RSI converge."
2025-03-13 11:52:39,ollama-DeepSeek-R1:latest,"A trend-following strategy that enters long or short when RSI divergence from price action diverges oppositely with MACD divergence while high volume signals confirmation, exiting at set ATR multiples."
2025-03-13 11:53:30,ollama-DeepSeek-R1:latest,"A volatility break strategy: Enter long when MACD is bullish but Bollinger Bands are in a downtrend phase with expanding width, exit on breach of lower band."
2025-03-13 11:53:47,ollama-gemma:2b,Develop a volatility-based trading strategy that utilizes support and resistance zones to identify potential reversals and trend breaks.
2025-03-13 11:54:06,ollama-llama3.2:latest,"Enter long positions when 50-period Bollinger Bands (20,2) are above price, but price is below the lower BB band, and exit if price touches or crosses over the upper BB band within the next 3 bars, with risk management via a stop-loss at 0.5 ATR distance."
2025-03-13 11:54:35,ollama-DeepSeek-R1:latest,Enter trades when price action aligns with divergence between a fractal indicator and Bollinger Bands while exiting based on ATR multiples during increased volatility.
2025-03-13 11:54:58,ollama-llama3.2:latest,"A mean-reversion strategy that enters when Bollinger Bands' lower band price action diverges from its upper band while volume decreases, with exits based on ATR multiples."
2025-03-13 11:58:31,ollama-DeepSeek-R1:latest,Enter long trades when RSI indicates overbought conditions and ADX suggests a strong uptrend; exit on divergence or decline in ADX confidence.
2025-03-13 11:59:54,ollama-DeepSeek-R1:latest,Use a combination of Stochastic Oscillator (SO) and Bollinger Bands with a Golden Ratio filter to determine entry/exit points during overbought/oversold conditions while adjusting position sizing based on volatility spikes.
2025-03-13 12:00:40,ollama-gemma:2b,Trend-following strategy based on fractal channels and stochastic oscillators.
2025-03-13 12:01:03,ollama-gemma:2b,Volume Cluster Breakout Strategy
2025-03-13 12:04:10,ollama-DeepSeek-R1:latest,"Enter a position when RSI indicates overbought while the MACD histogram shows divergence, exiting based on ATR volatility exceeding predefined levels."
2025-03-13 12:04:25,ollama-gemma:2b,Combine Bollinger Bands with Relative Strength (RS) to identify entry and exit points.
2025-03-13 12:04:41,ollama-llama3.2:latest,"A momentum-contrarian strategy that enters long positions during periods of high RSI and low VIX, with exits based on the correlation between the VIX and a 200-day moving average of price action."
2025-03-13 12:04:58,ollama-llama3.2:latest,"Sell put options on high-beta stocks during sideways or slightly up trending sessions, targeting expiration, while long-term positions are adjusted to maintain ATR-based stop-losses with a twist: exit if the stock starts showing signs of strength (increasing price action and increased volume) within 1-2 days."
2025-03-13 12:06:24,ollama-DeepSeek-R1:latest,Trade long when RSI diverges bearishly with price confirming Higher Highs and volume decreasing; exit on ATR multiple levels or RSI convergence.
2025-03-13 12:06:40,ollama-llama3.2:latest,"A trend-following momentum strategy that enters long positions when price action touches support from the Bollinger Bands' upper band, while also shorting on breaks above resistance from the lower Bollinger Band's moving average midpoint."
2025-03-13 12:07:03,ollama-DeepSeek-R1:latest,"Use Bollinger Bands to identify entry points when the close is above the upper band but below the 20-period moving average of the ATR, expecting a strong trend to sustain."
2025-03-13 12:07:28,ollama-DeepSeek-R1:latest,Final Answer:
2025-03-13 12:07:58,ollama-DeepSeek-R1:latest,A trend-following strategy employing the Chikou Span to anticipate price reversals in conjunction with Bollinger Bands' volatility readings.
2025-03-13 12:08:23,ollama-DeepSeek-R1:latest,"Use a combination of Bollinger Bands (BB) midpoints and MACD divergence for trend strength-based entries: go long when BB opens higher with MACD above midpoint during uptrend, short when BB tightens with MACD below midpoint during downtrend."
2025-03-13 12:08:37,ollama-llama3.2:latest,"A momentum-contrarian approach that longs contracts showing high liquidity and shorting those with inverse sentiment from institutional traders, as captured by the 20-day delta-neutral VIX futures spread."
2025-03-13 12:09:08,ollama-DeepSeek-R1:latest,"Close long trades when MACD bullish signal crosses above the signal line coincides with price touching the upper Bollinger Band, exiting on a subsequent pullback."
2025-03-13 12:09:35,ollama-gemma:2b,Unique Combination of Bollinger Bands and Stochastic Oscillator
2025-03-13 12:09:50,ollama-llama3.2:latest,"Sell put spreads at the open of European trading hours, targeting a 50% profit or loss within 30 minutes, with stop-loss set at the strike price of the covered call option plus 1 pip."
2025-03-13 12:10:22,ollama-DeepSeek-R1:latest,Enter short when MACD divergence indicates bearish momentum and RSI shows bearish divergence simultaneously; exit with take-profit at 2x average daily volume percentage change and stop-loss at 1x ATR from entry price.
2025-03-13 12:10:45,ollama-DeepSeek-R1:latest,A strategy involves identifying potential trend reversals when the price completes a Fibonacci retracement level and the MACD line crosses above or below its signal line simultaneously.
