timestamp,model,idea
2025-03-13 10:56:54,ollama-DeepSeek-R1:latest,"Use LOFAR to count price fluctuations in a timeframe, then employ a deep neural network trained on sentiment analysis and high-frequency data to predict whether the number of movements will exceed an expected fractal dimension threshold."
2025-03-13 10:57:11,ollama-llama3.2:latest,"Buy call options on S&P 500 futures when the VIX premium (delta-neutral spread) widens by at least 0.05 points above its 50-day moving average, with stops at breakeven and targets set at a 2 standard deviation price range expansion."
2025-03-13 10:57:27,ollama-gemma:2b,Long-Term Equity Arbitrage with Trend Following Indicators
2025-03-13 10:58:17,ollama-DeepSeek-R1:latest,Use VWAP convergence with AD divergence to enter trades at support/resistance levels and exit when the trend reverses.
2025-03-13 10:58:35,ollama-gemma:2b,"Utilizing advanced statistical arbitrage techniques, we can identify and exploit price discrepancies between Bitcoin and Ethereum based on the relative strength of their correlations with the US Dollar Index (USD). By employing sophisticated algorithms that combine technical indicators with statistical arbitrage, we can generate consistent alpha through arbitrage opportunities in these cryptocurrencies."
2025-03-13 10:58:51,ollama-llama3.2:latest,"A high-frequency mean-reversion strategy that exploits bid-ask bounce opportunities by tracking the 'price gap' between consecutive order book prints, with positions scaled to 1/10th of daily volume."
2025-03-13 11:01:07,ollama-DeepSeek-R1:latest,"An innovative trading strategy combining high-order fractals in market microstructure with RSI divergence, utilizing machine learning for automated entry/exit decisions to exploit trend reversals and continuations."
2025-03-13 11:01:46,ollama-DeepSeek-R1:latest,"Generate a momentum-based trading strategy that enters trades when an asset shows significant price momentum while simultaneously balancing risk using implied volatility and news volume signals to manage potential drawdowns, exiting upon achieving predefined risk-reward thresholds aligned with expected volatility decay post-trigger event."
2025-03-13 11:02:40,ollama-DeepSeek-R1:latest,"A volatility-based strategy that enters trades when MACD divergence suggests a downtrend conjunction with decreasing volume and concurrent high volatility spikes, exiting when price reverses or volatility returns to normal levels."
2025-03-13 11:02:56,ollama-gemma:2b,Combining Chaikin Money Flow and Stochastic Oscillator to Generate Alpha
2025-03-13 11:03:12,ollama-llama3.2:latest,Enter long positions in thinly traded futures contracts with high implied volatilities when order flow metrics reveal net bullish sentiment among hedgers and small traders.
2025-03-13 11:03:28,ollama-llama3.2:latest,"A mean-reversion strategy that enters when Bollinger Bands width exceeds 80% of the daily range, with exits based on a cointegration test of the ratio between price and its moving average (MA) scaled by volatility."
2025-03-13 11:03:45,ollama-llama3.2:latest,"Trade the 12-20 day relative strength index (RSI) mean reversion by entering long when RSI dips below 30 and exiting short on touch with a subsequent RSI rise above 50, adjusted for daily volume weights to reduce market impact."
2025-03-13 11:04:24,ollama-DeepSeek-R1:latest,"Buy when the 14-period RSI crosses above the 20-period EMA or 50-period EMA and exit short upon the signal reversing, using trailing stops to manage risk."
2025-03-13 11:04:43,ollama-llama3.2:latest,"Long/Short spread strategy that buys options on S&P 500 futures expiring in 1 week with a call put ratio equal to the daily VIX index, while shorting options on S&P 500 futures expiring in 3 months with a strike price equal to the 50-day moving average of the underlying futures."
2025-03-13 11:04:59,ollama-gemma:2b,"Utilizing sentiment analysis of social media conversations and news articles, generate signals for buying or selling cryptocurrencies based on the sentiment's alignment with the price movement."
2025-03-13 11:05:14,ollama-gemma:2b,Super-Trending Crypto Arbitrage using Multi-Market Momentum and Sentiment
2025-03-13 11:05:30,ollama-llama3.2:latest,A statistical arbitrage strategy that profits from mispricings in futures markets by identifying pairs with inverted price correlations across different maturities and leveraging inverse ETF swaps to exploit the discrepancy.
2025-03-13 11:05:44,ollama-gemma:2b,Trend-following arbitrage based on stochastic volatility and RSI divergence.
2025-03-13 11:06:01,ollama-llama3.2:latest,A contrarian sentiment-based strategy that exploits asymmetric trader responses to news releases by buying the underpriced asset with high short interest and selling the overpriced asset with low short interest.
2025-03-13 11:06:41,ollama-DeepSeek-R1:latest,A trend-following strategy using MACD Histogram crossovers alongside Bollinger Bands' upper/lower band touchpoints for entry/exit signals.
2025-03-13 11:06:55,ollama-gemma:2b,Cross-asset volatility arbitrage during market downturns.
2025-03-13 11:07:09,ollama-gemma:2b,Volatility Arbitrage on Price-Volume Ratios
2025-03-13 11:07:40,ollama-gemma:2b,Algorithmic Arbitrage on Price Discovery Patterns
2025-03-13 11:07:55,ollama-gemma:2b,Algorithmic Arbitrage Strategy based on Volatility Patterns and Order Flow
2025-03-13 11:08:10,ollama-gemma:2b,Cross-asset volatility arbitrage between Bitcoin and Ethereum
2025-03-13 11:08:25,ollama-gemma:2b,Combining volatility and order book dynamics for alpha generation.
2025-03-13 11:08:39,ollama-gemma:2b,Volatility-Based Trading Strategy:
2025-03-13 11:09:11,ollama-DeepSeek-R1:latest,Enter trades when RSI shows bearish divergence followed by a price break higher while volume spikes indicating heightened interest in a fractal price pattern formation.
2025-03-13 11:09:51,ollama-DeepSeek-R1:latest,"Enter trades when 2-period RSI diverges below price, coinciding with bearish 14-period RSI divergence on a short-term chart with decreasing volume, using Guppy Multiple Moving Averages for confirmation and exiting on ATR multiples."
2025-03-13 11:10:06,ollama-gemma:2b,Utilizing Statistical Arbitrage Opportunities in Option Spreads
2025-03-13 11:10:21,ollama-llama3.2:latest,A statistical arbitrage approach that targets co-integration breaks between stock price movements in adjacent sectors by entering long on overbought stocks from underperforming industries while shorting vice versa.
2025-03-13 11:10:37,ollama-llama3.2:latest,Uncover hidden value by combining order flow data with sentiment analysis to identify asymmetric price movements triggered by contradictory institutional and retail sentiments.
2025-03-13 11:10:52,ollama-gemma:2b,Long-term equity short-selling with trend-following indicators:
2025-03-13 11:11:38,ollama-DeepSeek-R1:latest,A machine learning model predicts upcoming volume spikes in large tick assets by analyzing order book imbalances and execution rate patterns.
2025-03-13 11:11:55,ollama-llama3.2:latest,"Utilize the 'Volume Convergence' indicator by calculating the ratio of intraday high-low range to daily high-low range, entering long positions when volume converges with the previous bar's convergence level while exceeding the current session's open interest."
2025-03-13 11:12:10,ollama-gemma:2b,Arbitrage on price discrepancies between liquid and illiquid cryptocurrency markets.
2025-03-13 11:12:25,ollama-llama3.2:latest,"Use a statistical arbitrage approach that identifies mispricings between cryptocurrency pairs by analyzing cross-asset correlations between Bitcoin, Ethereum, and USDT liquidity imbalances."
2025-03-13 11:12:42,ollama-llama3.2:latest,"A hybrid strategy that combines mean-reversion signals from the RSI-VIX correlation ratio with directional momentum confirmation via 15-minute order flow data, targeting high-yield bonds versus US Treasuries."
2025-03-13 11:13:41,ollama-DeepSeek-R1:latest,"Trade on order flow imbalance between short and long-term buyers, entering when a bullish fractal pattern forms with increased volume preceding a price decline."
2025-03-13 11:13:58,ollama-llama3.2:latest,"Identify emerging liquidity pools in the futures market by analyzing co-trending order book activity across Eurusdollar futures, yen futures, and gold futures, then dynamically rebalancing a 60/40 allocation between these assets based on relative participation rates."
2025-03-13 11:14:13,ollama-llama3.2:latest,A statistical arbitrage strategy that exploits the mispricing between futures contracts and their underlying index components by utilizing a machine learning-based model to predict and hedge the differences in these prices.
2025-03-13 11:15:19,ollama-DeepSeek-R1:latest,"A strategy combining MACD divergence and volume spikes: Enter a trade when the MACD line diverges from the signal line while simultaneously noting a volume spike in the opposite direction, holding until price movement reverses or ATR-based stop losses are triggered."
2025-03-13 11:15:51,ollama-DeepSeek-R1:latest,Trade pairs of assets where one outperforms its historical correlation with another asset while simultaneously trading against implied volatility spikes predicted by machine learning models.
2025-03-13 11:16:05,ollama-llama3.2:latest,"A statistical arbitrage approach exploiting the cross-asset correlation between cryptocurrency price movements and their social media sentiment, focusing on highly correlated but mispriced pairs."
2025-03-13 11:16:20,ollama-llama3.2:latest,"A statistical arbitrage strategy that exploits the mispricing of high-frequency order flow data on low-latency exchanges versus traditional markets, with profits scaled by the speed advantage gap."
2025-03-13 11:16:56,ollama-DeepSeek-R1:latest,"A break-out strategy using Bollinger Bands where the price breaches the lower band as resistance, then sets a trailing stop at the high of the last breach, adjusting the lookback period based on implied volatility for dynamic risk management."
2025-03-13 11:17:24,ollama-DeepSeek-R1:latest,Use Bollinger Bands with MACD to identify overbought/oversold signals for timing entries.
2025-03-13 11:17:38,ollama-gemma:2b,Cross-asset volatility clustering with multi-signature orders
2025-03-13 11:17:53,ollama-llama3.2:latest,"A value-based momentum strategy that longs overbought stocks with high institutional ownership and shorted undervalued stocks with low retail participation, scaled by the ratio of institutional ownership to retail participation."
2025-03-13 11:19:04,ollama-DeepSeek-R1:latest,"Buy when a bullish fractal forms in price action, while RSI is below 30 and MACD has crossed above the signal line."
2025-03-13 11:19:21,ollama-llama3.2:latest,"Buy short-term US Treasury futures (short ETFs) during periods of high volatility in 10-year T-bill yields, with stops at breakeven and exits when the spread between 10-year T-bill and 5-year T-bill widens by more than 15 basis points."
2025-03-13 11:19:54,ollama-DeepSeek-R1:latest,"A mean-reversion trading strategy that enters trades when MACD divergence occurs after a 50-period signal line crosses below zero, exits positions upon price retracing to the initial entry level or during periods of increased volatility, using stop-loss triggered by ATR-based thresholds."
2025-03-13 11:20:08,ollama-gemma:2b,Cross-asset arbitrage with sentiment indicators:
2025-03-13 11:20:40,ollama-DeepSeek-R1:latest,"A trend-following strategy that enters long when RSI diverges above price action and simultaneously volume decreases while implied volatility increases, with exits based on volatility breakouts."
2025-03-13 11:20:56,ollama-llama3.2:latest,Enter long EOD futures contracts when the difference between overnight high and overnight low is greater than 10% of the contract value and the VIX index is below its historical average for the same time period.
2025-03-13 11:21:12,ollama-llama3.2:latest,"A momentum-following strategy that captures alpha by scaling positions in the top 5% of daily order flow volume on low-volatility days with high-slam prices, while selling positions in the bottom 5%."
2025-03-13 11:21:47,ollama-DeepSeek-R1:latest,A strategy using MACD divergence combined with decreasing trading volume to signal potential reversals in momentum trends.
2025-03-13 11:22:19,ollama-DeepSeek-R1:latest,"A strategy that enters long when MACD diverges upwards alongside Bollinger Bands expanding, with exits based on BB contraction after the trend completes."
2025-03-13 11:22:32,ollama-gemma:2b,AI-driven Sentiment and Order Flow Arbitrage
2025-03-13 11:26:17,ollama-DeepSeek-R1:latest,"A trend-following strategy that enters long when bullish divergence occurs with prices breaking above the upper Keltner Channel in conjunction with expanded Bollinger Bands volatility, and exits upon a price correction below the channel."
2025-03-13 11:26:51,ollama-llama3.2:latest,"Buy put options on S&P 500 index when VIX (20-day) futures diverge from 20-day S&P 500 price action, with a maximum 2x leverage, and exit at first breach of a 10-trading-day moving average."
2025-03-13 11:27:40,ollama-DeepSeek-R1:latest,"A trend-following strategy that enters long when the RSI diverges from price action while VIX increases, exiting based on ATR multiples."
2025-03-13 11:28:08,ollama-llama3.2:latest,"A mean-reversion strategy that enters when Bollinger Bands' lower band is above 20-period moving average, with exits based on 2x ATR stops to capture re-test opportunities."
2025-03-13 11:28:39,ollama-DeepSeek-R1:latest,A Gann angle-based strategy using a 5-period SMA to confirm trend direction during intraday trading with profit targets set where the two indicators intersect.
2025-03-13 11:29:18,ollama-DeepSeek-R1:latest,"A trading strategy based on identifying self-similar price patterns using fractals, with entries triggered by divergence from Fibonacci retracement levels."
2025-03-13 11:29:43,ollama-DeepSeek-R1:latest,"Use Fibonacci retracement levels combined with contracting ATR bands to enter trades when price touches a Fibonacci level during an uptrend with decreasing volatility, closing positions on breakouts."
2025-03-13 11:29:57,ollama-llama3.2:latest,"Sell put options at expiration when VIX and S&P 500 are within a 5% correlation band, with entry trigger based on daily high and exit target set at next day's low."
2025-03-13 11:30:31,ollama-DeepSeek-R1:latest,Enter trades when RSI crosses above/below its Bollinger Bands during trending conditions and exit when price reverts.
2025-03-13 11:30:45,ollama-gemma:2b,Volatility Divergence Breakout Strategy
2025-03-13 11:31:00,ollama-gemma:2b,Identify and Trade High-Probability Breakout Opportunities in Volatility-Driven Markets
2025-03-13 11:31:13,ollama-gemma:2b,Combine Bollinger Bands with Stochastic Oscillator to identify potential breakout opportunities.
2025-03-13 11:31:26,ollama-gemma:2b,Volume Oversold Oscillator Breakout
2025-03-13 11:31:41,ollama-gemma:2b,"A volatility-based strategy that utilizes Bollinger Bands to identify potential breakouts when volatility is below its average. Once a breakout occurs, short the underlying asset until the Bollinger Bands expand to its upper band."
2025-03-13 11:31:53,ollama-gemma:2b,Volume-Driven Breakout Strategy
2025-03-13 11:32:08,ollama-llama3.2:latest,"A momentum-based breakout strategy that enters long positions when the 50-period RSI is below 30, exits on pullbacks to 20-period moving average level, with stops at 20% ATR above entry point."
2025-03-13 11:32:22,ollama-gemma:2b,Develop a volatility-based strategy that utilizes moving averages and RSI divergence to identify opportunities for high-probability breakout opportunities during periods of consolidation.
2025-03-13 11:32:35,ollama-gemma:2b,Backtesting Arbitrage Opportunity on Volatility Cliffs
2025-03-13 11:33:02,ollama-DeepSeek-R1:latest,"A trend-following strategy that uses Fibonacci retracement levels combined with MACD oscillator divergence, entering long/short based on both price convergence at retracement levels and momentum signals from MACD."
2025-03-13 11:33:15,ollama-gemma:2b,Dynamic Range Breakout with Fractal Support and Resistance
2025-03-13 11:33:30,ollama-llama3.2:latest,"Enter long positions when the 50-period Bollinger Band Midpoint (BBMP) is above the Simple Moving Average (SMA), and exit when it's below the SMA, with a trailing stop set at 2 standard deviations from the BBMP."
2025-03-13 11:33:44,ollama-llama3.2:latest,"Sell put options during times of high open interest in declining futures contracts, exiting when open interest begins to increase."
2025-03-13 11:33:57,ollama-llama3.2:latest,Buy put spreads on index ETFs during periods of low liquidity (e.g.
2025-03-13 11:34:12,ollama-gemma:2b,"Combining Relative Strength Index divergence and Stochastic oscillator convergence can generate a unique trading strategy. This strategy would enter long when the RSI diverges from price action while the Stochastic oscillator displays convergence, indicating a potential trend reversal."
2025-03-13 11:34:43,ollama-DeepSeek-R1:latest,"A mean-reversion strategy that uses a divergence between RSI(20) and Stochastic Oscillator(8,20), entering short when RSI(20) > 20-period MA while SO(8) < 20-period MA, exiting on SO/RSI reversion or price reaching $10/$50."
2025-03-13 11:35:11,ollama-DeepSeek-R1:latest,"A trend-following strategy that enters long/short positions when MACD divergence occurs while RSI indicates overbought/oversold conditions, with exits based on volatility measures like ATR."
2025-03-13 11:35:26,ollama-llama3.2:latest,"A momentum-driven trend-following strategy that combines the Average True Range (ATR) with a proprietary 'momentum-score' derived from the product of RSI and Bollinger Bands, entering long positions on bullish RSI divergence and short positions on bearish."
2025-03-13 11:35:40,ollama-llama3.2:latest,Sell put options on the inverse ETF of a 3-day moving average crossover momentum indicator.
2025-03-13 11:36:48,ollama-DeepSeek-R1:latest,"Trade based on RSI divergence from price action while price is at a Fibonacci retracement level; enter trades in the direction of divergence, exit on ATR multiples."
2025-03-13 11:37:02,ollama-llama3.2:latest,"Enter long positions during 60-minute highs in the overnight session, adjusted for sector rotation using the EROD ratio. Set stop-loss at 5% below entry price based on ATR."
2025-03-13 11:37:16,ollama-llama3.2:latest,"Buy stocks with high short interest coverage and strong put-call ratio at lower price levels for subsequent gap-down fills, targeting 10-20% gains on the upside."
2025-03-13 11:37:31,ollama-llama3.2:latest,A momentum reversal strategy that enters long positions when the difference between 50-period moving average and 200-period moving average crosses above the 20-period exponential moving average.
2025-03-13 11:37:43,ollama-gemma:2b,Technical Indicators with Unique Combinations
2025-03-13 11:38:07,ollama-DeepSeek-R1:latest,"A mean-reversion strategy that enters trades with divergent RSI relative to Bollinger Bands when BBs become overextended, using volume spikes as confirmation, and exits on ATR multiples or contract rollback."
2025-03-13 11:38:33,ollama-DeepSeek-R1:latest,"Enter long trades when price crosses above 20-period SMA and simultaneously touches 61.8% Fibonacci retracement, exiting upon bearish divergence of RSI(14) confirmed with ATR risk."
2025-03-13 11:38:46,ollama-gemma:2b,Trend-following strategy using fractal patterns:
2025-03-13 11:39:00,ollama-gemma:2b,"Identify and trade when price action breaks above the upper Bollinger Band and volume is above the average volume, indicating potential breakout with bullish engulfing patterns."
2025-03-13 11:39:29,ollama-DeepSeek-R1:latest,"A trend-following strategy using 50-day and 200-day Moving Averages crossing in bearish territory with lower-than-average volume, expecting price action to diverge before breaking into a new volatility breakout, exited via Bollinger Bands."
2025-03-13 11:39:42,ollama-gemma:2b,Identifying potential liquidity breakouts using volume clusters and volatility filters.
2025-03-13 11:39:56,ollama-llama3.2:latest,A momentum-based strategy that captures directional changes in stock prices by buying the top 20% and selling the bottom 20% of daily bar range gaps.
2025-03-13 11:40:16,ollama-DeepSeek-R1:latest,A mean-reversion strategy utilizing RSI and MACD divergence with exits based on VIX volatility spikes.
2025-03-13 11:40:31,ollama-llama3.2:latest,"A momentum-based strategy that longs 20-period RSI-oscillator below 30 concurrent with 5-period moving average above 50-day Simple Exponential Moving Average (50-day SEMA), with adjustments based on Bollinger Bands' price movement ratios."
2025-03-13 11:40:43,ollama-gemma:2b,"Volume Oscillator Divergence Strategy"":"
2025-03-13 11:40:56,ollama-gemma:2b,Identify volatile turning points using fuzzy logic and support & resistance zones.
2025-03-13 11:41:11,ollama-llama3.2:latest,"A directional momentum strategy that longs when a 5-period RSI falls below its corresponding price action low for the past 3 periods, while shorting when a 10-period MA is above a declining 20-period Bollinger Band."
2025-03-13 11:41:25,ollama-gemma:2b,Identify trading opportunities using Harmonic Oscillator and Relative Strength Index convergence.
2025-03-13 11:41:39,ollama-llama3.2:latest,"Sell put options on futures contracts that have closed above their 200-period moving average price range in the past month, with stop-loss at 20% below and limit-up at 10% above current price action."
2025-03-13 11:42:05,ollama-DeepSeek-R1:latest,"A trend-following strategy using EMA for trend identification and Bollinger Bands for volatility control, entering on upward EMA crossover with rising BWW and confirming with RSI strength, exiting upon BWW contraction or significant RSI divergence."
2025-03-13 11:42:19,ollama-llama3.2:latest,"Profit from contrarian momentum by buying underperformed stocks 3 days after earnings release, with stops set at the 2% price drop threshold."
2025-03-13 11:42:35,ollama-llama3.2:latest,"A 'Trend Reversal Trigger' strategy that longs when the 50-period moving average crosses below the 200-period moving average while the short-term relative strength index (RSI) is above 40 and price has breached its 20-day Bollinger Bands upper limit, with exits based on subsequent RSI resets."
2025-03-13 11:42:51,ollama-gemma:2b,"Utilizing the unique combination of Bollinger Bands and Stochastic Oscillator, this strategy would identify potential reversal points for stocks exhibiting consolidation patterns with a significant increase in volume during the breakout."
2025-03-13 11:43:06,ollama-llama3.2:latest,"A momentum-based strategy that captures the mean reversion potential of VIX futures versus their respective underlying stock's option implied volatility, with long positions in the underperforming VIX future and short positions in the overperforming underlying stock's options."
2025-03-13 11:43:30,ollama-DeepSeek-R1:latest,A trend-following strategy that uses Fibonacci retracement levels combined with MACD to enter trades when potential support/resistance is confirmed by MACD momentum.
2025-03-13 11:43:44,ollama-llama3.2:latest,"Buy stocks with high gamma hedge ratio (>1.2) during periods of low VIX (<20), expecting a mean-reversion in implied volatility as the market shifts to higher volatility."
2025-03-13 11:44:04,ollama-DeepSeek-R1:latest,A strategy where traders enter trades after confirming a Fibonacci retracement level completion if accompanied by rising or falling momentum.
2025-03-13 11:44:18,ollama-llama3.2:latest,A momentum-based strategy that enters long positions when 50-period Bollinger Bands width contracts and then exits when the ratio of 20-period RSI to Bollinger Band upper band exceeds 1.5.
2025-03-13 11:44:47,ollama-DeepSeek-R1:latest,"Trade pairs with sustained trend momentum by identifying price突破 above or below 2 standard deviation Bollinger Bands while simultaneously observing divergence in the Relative Strength Index (RSI), positioning short-covering opportunities during uptrends or long-covering during downtrends."
2025-03-13 11:45:00,ollama-gemma:2b,Volatility-based strategy:
2025-03-13 11:45:13,ollama-gemma:2b,Trend-following strategy based on Fibonacci Retracement and Ichimoku Cloud
2025-03-13 11:47:05,ollama-DeepSeek-R1:latest,Unique Trading Strategy:
2025-03-13 11:47:25,ollama-DeepSeek-R1:latest,Trade a short position when RSI is overbought but upside volume outperforms downside volume in an uptrend market.
2025-03-13 11:47:48,ollama-DeepSeek-R1:latest,"A volatility-pairs strategy that enters trades when the MACD divergence diverges from price action while RSI shows divergence, closing positions based on ATR multiples."
2025-03-13 11:48:05,ollama-llama3.2:latest,"A momentum-driven strategy that captures the spread between 50-period SMA and EMA crossover signals while trading on the difference in mean reversion rate (MRR) generated by the MACD delta indicator's deviations from its average value, scaling positions with the market volatility as indicated by ATR ratio."
2025-03-13 11:48:17,ollama-gemma:2b,Volume Breakout Strategy
2025-03-13 11:48:31,ollama-gemma:2b,Develop an arbitrage opportunity using volatility patterns and price action reversals.
2025-03-13 11:48:45,ollama-gemma:2b,High-frequency volatility arbitrage with RSI divergence:
2025-03-13 11:49:00,ollama-gemma:2b,Trend-following system based on Harmonic Oscillator and Moving Average Convergence
2025-03-13 11:49:40,ollama-DeepSeek-R1:latest,"Enter trades when the price action reverses after hitting fractal symmetry and Fibonacci retracement levels, exiting based on volatility spikes."
