timestamp,model,idea
2025-03-13 09:44:10,ollama-DeepSeek-R1:latest,Trade on MACD divergence with entries when price is breaking out beyond upper Bollinger Bands and within a Fibonacci time zone.
2025-03-13 09:45:00,ollama-gemma:2b,Arbitrage on market order book imbalances and order flow reversals.
2025-03-13 09:45:38,ollama-DeepSeek-R1:latest,Trade short gamma positions during periods of high order flow imbalance that suggest an upcoming intra-day price reversal on shorter time frames.
2025-03-13 09:49:08,ollama-gemma:2b,"Utilizing sentiment analysis of social media data, identify trading opportunities where negative sentiment is significantly correlated with upcoming down trends in specific sectors."
2025-03-13 09:52:35,ollama-DeepSeek-R1:latest,"Trade long on Fibonacci retracement resistance levels entering when price approaches these levels while volume decreases, exiting upon breaking through or reversing."
2025-03-13 09:55:06,ollama-llama3.2:latest,"A statistical arbitrage strategy that exploits non-synchronous bid-ask spreads across EFP (Exchange for Physical) contracts for commodities, entering long positions when the difference between futures and EFP prices is greater than 2%."
2025-03-13 09:56:18,ollama-DeepSeek-R1:latest,Use a Vola-Weighted ATR (VWATR) moving average to filter volatility noise while identifying divergence with VWATR price action as a trade signal when the difference exceeds 2 standard deviations.
2025-03-13 09:58:19,ollama-gemma:2b,Cross-Asset Divergence Trading Strategy:
2025-03-13 09:58:31,ollama-gemma:2b,Smart Money Zone Arbitrage:
2025-03-13 10:00:48,ollama-gemma:2b,Develop a momentum-based trading strategy that utilizes a combination of relative strength and stochastic oscillators to identify high-probability trading opportunities.
2025-03-13 10:01:01,ollama-llama3.2:latest,"Sell puts on an ETF that tracks the inverse S&P 500 if its implied volatility is higher than the VIX, with stop-loss at 20% above spot price."
2025-03-13 10:01:15,ollama-gemma:2b,Dynamic Butterfly Oscillator Strategy
2025-03-13 10:01:39,ollama-DeepSeek-R1:latest,A strategy combines Fibonacci retracement levels with Relative Strength Index (RSI) to identify divergence points for trade signals.
2025-03-13 10:01:54,ollama-llama3.2:latest,"A momentum-based arbitrage strategy utilizing order flow data from major currency pairs to identify divergent liquidity, capturing the alpha from asymmetric trading opportunities."
2025-03-13 10:02:10,ollama-llama3.2:latest,"A statistical arbitrage strategy that exploits cross-asset correlations by buying the underperforming US dollar against overperforming cryptocurrencies like Bitcoin or Ethereum, with a twist of incorporating implied volatility in USD futures contracts to enhance returns."
2025-03-13 10:02:36,ollama-DeepSeek-R1:latest,Trade intra-day using high-frequency Fibonacci retracement support/resistance levels entered during periods of low volatility.
2025-03-13 10:02:52,ollama-llama3.2:latest,A value-based momentum trap strategy that captures short-term mean-reversion opportunities by buying overbought futures contracts with high implied theta and selling undervalued options contracts with low delta.
2025-03-13 10:03:08,ollama-llama3.2:latest,"Buy high-yield bonds with inverted yield curves (20-30 years vs 2-5 years) and short US dollar futures for a 6-month window when the 10-year Treasury yield exceeds the S&P 500's forward price, to capture carry trade benefits and beta reduction."
2025-03-13 10:03:36,ollama-DeepSeek-R1:latest,A strategy using price fractals for trend detection and confirming with order flow depth at specific times when a buy signal appears from the fractals.
2025-03-13 10:04:03,ollama-DeepSeek-R1:latest,"A trend-following strategy using MACD divergence combined with Fibonacci retracement levels to identify overbought conditions, entering trades when both indicators concur for a pullback opportunity."
2025-03-13 10:04:18,ollama-llama3.2:latest,Sell 3x leveraged inversely correlated ETF pairs during US session's mean reversion windows (based on CCI and Bollinger Bands) that coincide with strong futures market makeovers.
2025-03-13 10:04:33,ollama-gemma:2b,AI Sentiment Arbitrage for Alpha
2025-03-13 10:04:52,ollama-llama3.2:latest,"Sell calls when the difference between VIX futures and cash VIX is greater than 0.1, with a stop-loss at 20% above the current price, and take profits at 40%."
2025-03-13 10:05:06,ollama-gemma:2b,Combining stochastic oscillators with option pricing to identify profitable trading opportunities in thinly traded stocks.
2025-03-13 10:06:06,ollama-DeepSeek-R1:latest,Trade on fractal patterns within Bollinger Bands by entering when a 5-period fractal completes and exiting at the nearest +/-2 standard deviation level.
2025-03-13 10:06:42,ollama-llama3.2:latest,"A mean-reversion strategy that enters when RSI diverges from price action while volume decreases, with exits based on ATR multiples."
2025-03-13 10:07:04,ollama-gemma:2b,Harnessing Market Dynamics: Arbitrage on Unfavorable Volatility Clusters
2025-03-13 10:07:22,ollama-gemma:2b,Leveraged Arbitrage on Volatility Waves:
2025-03-13 10:07:42,ollama-llama3.2:latest,"Sell overbought puts on the VIX futures contract at the beginning of each calendar quarter, targeting a maximum 5% move in the first 50 days post-expiration to capture the seasonal decline in market volatility and limit exposure to potential large moves upwards."
2025-03-13 10:07:58,ollama-gemma:2b,Arbitrage on Microstructure Patterns of Volatility and Order Flow.
2025-03-13 10:08:13,ollama-gemma:2b,Identify and trade high-frequency options trade clusters.
2025-03-13 10:08:44,ollama-DeepSeek-R1:latest,Trade based on price corrections to Fibonacci retracement levels with confirmation of increasing volume as potential entry points.
2025-03-13 10:08:59,ollama-llama3.2:latest,"Buy high-yield bonds with inverted yield curves, selling covered calls to profit from decreasing convexity while managing exposure to credit risk."
2025-03-13 10:09:31,ollama-DeepSeek-R1:latest,"Buy/hold when implied volatility decreases while realized volatility spikes, paired with a significant jump in trading volume."
2025-03-13 10:10:16,ollama-DeepSeek-R1:latest,"A volatility-based strategy that combines Stochastic Oscillator (SO) divergence with MACD momentum signals, entering trades only when SO indicates overbought/oversold in conjunction with diverging from MACD's direction, using ATR for risk management and Theta decay as time approaches expiration."
2025-03-13 10:10:32,ollama-llama3.2:latest,"A statistical arbitrage strategy that exploits cross-asset correlations by buying the low-volatility ETF with the highest correlation to the low-volatility US bond index while selling the high-volatility ETF with the lowest correlation, using a moving average-based momentum indicator."
2025-03-13 10:11:07,ollama-DeepSeek-R1:latest,"Enter trades when price aligns with both fractal pattern recognition and Fibonacci retracement levels, capturing overbought/oversold signals."
2025-03-13 10:12:11,ollama-DeepSeek-R1:latest,"A strategy that combines MACD Histogram divergence with Bollinger Bands upper band cross down to enter long positions, using it as a confirmation after MACD signals."
2025-03-13 10:12:27,ollama-llama3.2:latest,"A momentum-neutral statistical arbitrage strategy that exploits the cross-asset correlation between high-yield bond spreads and VIX futures, entering positions where spread tightness converges with expected volatility."
2025-03-13 10:12:40,ollama-gemma:2b,Volatility Butterfly Strategy:
2025-03-13 10:12:54,ollama-gemma:2b,Microstructure Pattern Breakout Trading
2025-03-13 10:13:10,ollama-gemma:2b,Algorithmic Butterfly Pattern Recognition
2025-03-13 10:13:24,ollama-gemma:2b,Identify and Trade Price Action Patterns at Divergence Points
2025-03-13 10:14:06,ollama-DeepSeek-R1:latest,A mean-reversion strategy using ATR volatility bands combined with RSI divergence and IVOL as an exit signal based on theta decay.
2025-03-13 10:14:45,ollama-DeepSeek-R1:latest,"A trading strategy that enters when the Average True Range (ATR) crosses above the 5-star Fractal indicator while the market exhibits sustained strength over a specific lookback period, aiming for profits during high volatility and favorable trend alignment."
2025-03-13 10:15:00,ollama-llama3.2:latest,"Enter long positions in the inverse correlation between futures' high-frequency delta-neutral contracts and their spot price futures, with stop-loss at 1% below opening price."
2025-03-13 10:15:39,ollama-DeepSeek-R1:latest,"A machine learning model predicts realized volatility jumps using EOD realized variance and IV skews during off-hours, outperforming HAR or MIDAS."
2025-03-13 10:15:54,ollama-gemma:2b,Utilizing Statistical Arbitrage Opportunities in Microstructure Patterns:
2025-03-13 10:16:16,ollama-llama3.2:latest,Sell high-yield bond futures when 1-day interest rate spreads (compared to 2-day) widen by more than 10bps while short-term implied volatility converges with long-term term premium.
2025-03-13 10:16:33,ollama-gemma:2b,"Combining high-frequency order flow analysis with sentiment analysis, we can identify and trade short-duration options strategies based on the interplay of price, volume, and sentiment indicators. This approach allows for capturing alpha by exploiting the opportunities presented by both market microstructure and sentiment dynamics."
2025-03-13 10:17:11,ollama-DeepSeek-R1:latest,"Trade a mean-reversion position between gold and silver when their Pearson correlation coefficient exceeds 0.6, going long on one while shorting the other with equal dollar allocations, exiting upon reversion of the correlation."
2025-03-13 10:17:27,ollama-gemma:2b,Dynamic Breakout and Reverse Entry with Stochastic Oscillator Bands
2025-03-13 10:17:41,ollama-gemma:2b,Microstructure Pattern Breakout Strategy:
2025-03-13 10:18:25,ollama-DeepSeek-R1:latest,"Trade when the fractal dimension indicates low volatility/trend strength and RSI shows divergence from price action, closing positions at 10% profit or 2% risk for scalping opportunities."
2025-03-13 10:18:40,ollama-gemma:2b,Utilizing Statistical Arbitrage Opportunities in Volatility-Driven Markets
2025-03-13 10:18:56,ollama-llama3.2:latest,"A statistical arbitrage approach that exploits the misalignment between short-term high-frequency order flow data and long-term macroeconomic indicators, focusing on correlations between S&P 500 futures prices and implied volatility."
2025-03-13 10:19:10,ollama-gemma:2b,High-frequency order flow analysis:
2025-03-13 10:19:24,ollama-gemma:2b,Harnessing Supply and Demand Oscillation for Alpha Generation
2025-03-13 10:19:37,ollama-gemma:2b,Trend-following bot with fractal analysis:
2025-03-13 10:19:53,ollama-llama3.2:latest,"Enter long positions in futures contracts during periods of high implied volatility relative to actualized price movements, with stop-loss set at 1 standard deviation below the market price."
2025-03-13 10:20:07,ollama-gemma:2b,Hybrid Wave-Cluster Arbitrage Strategy:
2025-03-13 10:20:37,ollama-DeepSeek-R1:latest,Trade long when MACD Histogram crosses above zero while price makes new lows.
2025-03-13 10:21:11,ollama-DeepSeek-R1:latest,"Use an RNN-based sentiment model to identify market sentiment shifts in real-time, then trade contrarily when predicted sentiment reversal is confirmed alongside increased market volatility as a confirmation signal."
2025-03-13 10:21:51,ollama-DeepSeek-R1:latest,"Enter trades when market breadth outperforms relative strength and sentiment indicates potential sell-off, exiting on break of key support/resistance."
2025-03-13 10:22:05,ollama-gemma:2b,Arbitrage between illiquid cryptocurrencies and their underlying assets using machine learning-driven pattern recognition and risk-adjusted order flow analysis.
2025-03-13 10:22:19,ollama-gemma:2b,Microstructure Breakout Trading
2025-03-13 10:22:34,ollama-llama3.2:latest,"Buy overbought stocks that exhibit an increased relative strength indicator (RSI) divergence from price action while their cumulative directional movement (CDM) remains bullish, with a stop-loss at 2x ATR below entry."
2025-03-13 10:22:50,ollama-llama3.2:latest,"Sell VIX futures 90 days before major US earnings season events, targeting a correlation reversal into subsequent months to capture alpha from option traders' increasing expectation premiums."
2025-03-13 10:23:36,ollama-DeepSeek-R1:latest,"A trend-following strategy that uses Fibonacci retracement levels combined with MACD divergence signals for entry points, validated by Volume Price analysis during pullbacks to confirm trend strength."
2025-03-13 10:24:03,ollama-DeepSeek-R1:latest,"Enter trades when a fractal pattern forms alongside increased order flow accumulation on the opposite side, using this for trend entry points."
2025-03-13 10:24:38,ollama-DeepSeek-R1:latest,Trade contrarily when Bitcoin's H1 correlation with U.S.
2025-03-13 10:24:53,ollama-llama3.2:latest,"A mean-reversion strategy that enters long positions when Bollinger Bands' standard deviation converges to its moving average, while exits are triggered by the first bounce above 2 standard deviations."
2025-03-13 10:25:07,ollama-gemma:2b,Combining Trend-Following and Volatility Arbitrage
2025-03-13 10:25:22,ollama-gemma:2b,"Utilizing market microstructure patterns and order flow analysis, we can identify and execute trade opportunities where large institutional orders enter and exit within seconds of each other, generating significant alpha."
2025-03-13 10:26:04,ollama-DeepSeek-R1:latest,"Use non-linear moving average crossovers to identify trend reversals while RSI confirms strength, then trade on BBANDS volatility deviations for entry/exit signals."
2025-03-13 10:26:39,ollama-DeepSeek-R1:latest,"Enter trades when Fibonacci retracement levels are confirmed by increasing ATR volatility, exiting upon divergence or when the ATR stabilizes."
2025-03-13 10:27:16,ollama-DeepSeek-R1:latest,"Use high-frequency volume-based divergence to trade during periods of low volatility, entering when price trends diverge from minute-by-minute volume changes."
2025-03-13 10:28:02,ollama-DeepSeek-R1:latest,Use high-order momentum combined with a unique volatility ratio targeting approach for trend entry/exit points.
2025-03-13 10:28:20,ollama-llama3.2:latest,"A statistical arbitrage strategy that exploits co-integration breaks in the correlation between S&P 500 futures and their implied volatility futures, entering long the cheap beta spread and shorting the rich beta spread when beta divergence exceeds 1.5."
2025-03-13 10:28:35,ollama-llama3.2:latest,"Sell puts on stocks that have seen unusual increase in short interest compared to their 52-week highs, with a stop-loss at the bid price."
2025-03-13 10:29:04,ollama-DeepSeek-R1:latest,"Use a short position when MACD line crosses below signal line and Bollinger Bands indicate tight volatility, expecting price reversal."
2025-03-13 10:29:19,ollama-gemma:2b,Volatility-Driven Arbitrage Strategy:
2025-03-13 10:29:32,ollama-gemma:2b,AI-Powered Sentiment Arbitrage:
2025-03-13 10:29:50,ollama-llama3.2:latest,"A statistical arbitrage strategy that exploits the difference in stock price returns between high-frequency traded stocks and illiquid, low-volatility stocks, entering long positions when the former's return exceeds the latter's by at least 3 standard deviations."
2025-03-13 10:30:06,ollama-llama3.2:latest,"Buy high-yield bond ETFs during times of high central bank liquidity, as measured by overnight repurchase auctions, with stop-loss at 2% yield loss to capture risk-reward tradeoff."
2025-03-13 10:30:20,ollama-gemma:2b,Arbitrage on Microstructure Patterns: Uncovering Hidden Opportunities
2025-03-13 10:30:37,ollama-llama3.2:latest,"A statistical arbitrage strategy that identifies mispriced correlations between high-frequency order flow data from multiple currencies, entering long positions when the correlation spread exceeds historical thresholds and exiting when it converges."
2025-03-13 10:30:53,ollama-gemma:2b,"Utilizing volatility and order flow analysis, we can identify and trade emerging trend reversals through a combination of stochastic momentum indicators like RSI divergence from price action with stochastic volatility indicators like VIM."
2025-03-13 10:31:09,ollama-llama3.2:latest,"Enter long positions in the VIX futures market when the difference between VIX futures and cash prices is less than 10% more than the historical average discrepancy at similar times of year, with exits based on a 2-day trailing stop-loss."
2025-03-13 10:31:23,ollama-gemma:2b,Combine trend-following with arbitrage opportunities.
2025-03-13 10:31:54,ollama-DeepSeek-R1:latest,A strategy that combines RSI momentum with Fibonacci retracement levels to identify overbought/oversold conditions and potential price reversals.
2025-03-13 10:32:12,ollama-llama3.2:latest,"A cross-asset arbitrage strategy that exploits asymmetric risk premia by buying the VIX futures contract with a longer expirations dates, selling the shorter-dated VIX futures contracts, and shorting the implied volatility of high-yield corporate bonds."
2025-03-13 10:32:27,ollama-llama3.2:latest,A momentum-capture strategy that exploits asymmetric price responses to order flow imbalances by focusing on high-frequency data from low-latency exchanges and identifying trades with 'asymmetric' size-volume ratios (>1.2)
2025-03-13 10:37:03,ollama-DeepSeek-R1:latest,"The final answer is a unique strategy that combines a bullish fractal pattern with RSI divergence, both of which are indicators used in trading. This approach aims to anticipate trend reversals by identifying specific geometric price patterns alongside momentum signals."
2025-03-13 10:37:20,ollama-llama3.2:latest,A statistical arbitrage approach that exploits cross-asset correlations by buying the underperforming sector of the S&P 500 and selling the overperforming tech sector on days when the US dollar index strengthens relative to emerging markets.
2025-03-13 10:41:54,ollama-DeepSeek-R1:latest,MACD Histogram Divergence with SO
2025-03-13 10:42:09,ollama-gemma:2b,High-Frequency Breakout Trading with Sentiment Analysis
2025-03-13 10:42:26,ollama-llama3.2:latest,A statistical arbitrage approach that exploits cross-asset correlations by buying under-volatility priced futures contracts and selling over-volatility priced currencies futures contracts with similar underlying spot prices.
2025-03-13 10:43:04,ollama-DeepSeek-R1:latest,"Trade on divergence between Bollinger Bands volatility and Order Flow Intensity, entering positions when BB volatility spikes but OFI decreases, exiting upon reversal of OFI rise and BB normalization."
2025-03-13 10:43:20,ollama-llama3.2:latest,"A statistical arbitrage approach that exploits correlations between futures contracts with opposite price movements but identical underlying assets, entering long the underperformer and short the outperformer upon correlation reversal."
2025-03-13 10:43:53,ollama-DeepSeek-R1:latest,Combine a bullish divergence signal using a 50-day and 200-day simple moving average with bearish momentum indicated by declining volumes in advancing issues relative to declining ones on an exchange-traded fund.
2025-03-13 10:45:26,ollama-DeepSeek-R1:latest,Trade when price touches an upper/lower Bollinger Band and volume spikes exceed the 90th percentile of its recent distribution.
2025-03-13 10:45:41,ollama-llama3.2:latest,"Buy a 2x1 long-short ETF spread at market opening, holding for 30 minutes if the opening range expansion is less than 10% and scaling out on subsequent openings with increasing leverage."
2025-03-13 10:45:57,ollama-llama3.2:latest,"A statistical arbitrage strategy that exploits the co-movement relationship between implied and historical volatility across different time horizons, with positions scaled by the Sharpe ratio of each market's volatility term structure."
2025-03-13 10:46:14,ollama-llama3.2:latest,"A statistical arbitrage strategy that exploits cross-asset correlations between VIX futures and the V2X (VIX futures vs. S&P 500) index spread, entering long when VIX spreads widen and shorting when they narrow."
2025-03-13 10:46:52,ollama-DeepSeek-R1:latest,"Enter trades when close approaches a Fibonacci retracement level on a 50-period time frame with Bollinger Bands narrowing, closing if the price fails to reverse above the lower Bollinger Band in 30 minutes."
2025-03-13 10:47:13,ollama-gemma:2b,"Utilizing technical indicators and the Relative Strength Index (RSI), we can identify potential trading opportunities by detecting when the RSI diverges from its average price and volume ratios diverge. When this divergence persists for a sustained period, the RSI crosses above its average price, indicating a potential breakout or reversal."
2025-03-13 10:47:28,ollama-llama3.2:latest,Sell call options on the first close after a significant economic data release if the subsequent open is within 0.5% of previous day's high/low.
2025-03-13 10:48:06,ollama-DeepSeek-R1:latest,"A trend-following strategy using the Chikou Span to predict price reversals combined with the MACD for diverging signals, entering trades when indicators diverge and exiting upon ATR-based volatility."
2025-03-13 10:48:42,ollama-DeepSeek-R1:latest,"Use fractal-based pattern recognition alongside momentum indicators to identify divergent market movements, entering trades when such convergence suggests a potential reversal."
2025-03-13 10:48:58,ollama-llama3.2:latest,"A statistical arbitrage opportunity that exploits the difference in expected return between put-call options with identical strike prices but different underlying assets and maturities, bought on one side and sold short on another."
2025-03-13 10:49:34,ollama-DeepSeek-R1:latest,"Trade long in trending markets using a combination of volume strength, moving average trends, and ATR-based risk management, entering when volume spikes preceded by a bullish VIX reading and exiting at defined profit levels."
2025-03-13 10:49:48,ollama-gemma:2b,Volatility Arbitrage with Quantum Oscillator Bands
2025-03-13 10:50:04,ollama-gemma:2b,Combine volatility and sentiment indicators to identify trading opportunities.
2025-03-13 10:50:21,ollama-llama3.2:latest,"A statistical arbitrage approach utilizing the 'tail risk' of market makers' inventory levels, which is predicted by an LSTM model trained on order flow data from futures markets, to identify mispricings in correlated markets."
2025-03-13 10:51:02,ollama-DeepSeek-R1:latest,A dynamic statistical arbitrage strategy using multiple cointegrated asset pairs across sectors combined with a machine learning model to predict reversion points based on co-integration for adaptive mean-reverting trades.
2025-03-13 10:51:35,ollama-DeepSeek-R1:latest,Trade contrarily on the divergence between MACD histogram momentum and the number of market participants using high-frequency order flow data.
2025-03-13 10:52:13,ollama-DeepSeek-R1:latest,"Enter a short position when RSI exhibits bearish divergence while MACD signals bullishness, with exits triggered when both indicators confirm divergence and VIX is below upper Bollinger Bands."
2025-03-13 10:52:28,ollama-llama3.2:latest,Sell options on underpriced stocks with high overnight intraday price movements exceeding 3% above their buyback points based on order flow data from 12pm ET closing prices.
2025-03-13 10:52:44,ollama-llama3.2:latest,A statistical arbitrage strategy that exploits the mispricing of cross-asset correlations by simultaneously buying the underperforming asset and selling the overperforming asset in the first quartile of daily markets.
2025-03-13 10:52:59,ollama-llama3.2:latest,"A statistical arbitrage strategy that exploits the co-movement between VIX futures and underlying S&P 500 index futures, with simultaneous entry and exit based on their relative convexity."
2025-03-13 10:53:14,ollama-gemma:2b,Identify and trade based on reversals of volatility clusters and the presence of bullish engulfing patterns in options markets.
2025-03-13 10:53:29,ollama-llama3.2:latest,A mean-reversion strategy that enters when Bollinger Bands collapse while market order flow data reveals simultaneous liquidity suppression across multiple exchanges.
2025-03-13 10:53:45,ollama-llama3.2:latest,"A sentiment-neutral momentum strategy that longs the stocks that are heavily shorted by hedge funds but not yet being covered, as indicated by option volumes and short interest ratios."
2025-03-13 10:54:26,ollama-DeepSeek-R1:latest,"Use recent returns (last 10 periods) showing consistent trend reversals as an entry signal when combined with high volume and increased volatility, exiting using ATR multiples and a maximum hold period based on time series momentum."
2025-03-13 10:54:42,ollama-llama3.2:latest,"A momentum-based strategy that captures contrarian flows by monitoring the ratio of sell-to-buy orders placed at the open versus close in futures markets, with long positions taken when the ratio exceeds 1.5."
2025-03-13 10:54:58,ollama-llama3.2:latest,"Enter long ETFs when 90% of all available stocks are oversold (Bollinger Bands lower band) and the inverse VIX is above its 50-period moving average, with stops at 20% above entry points."
2025-03-13 10:56:21,ollama-DeepSeek-R1:latest,Generate alpha by exploiting divergence signals when price action aligns with harmonic patterns and high-order volume spikes confirm convergence.
